,accuser_username,subtweet_evidence,subtweet_evidence_id,subtweeter_username,alleged_subtweet,alleged_subtweet_id
126,JoelKrass,@bornmiserable Reads like a Gothicaseas subtweet.,948020018289131520,bornmiserable,She’s got legs.  She’s got arms.  She’s got heads.  She’s got torsos.  She’s got a cold storage warehouse full of body parts.,948019570652037121
127,MENAGfCrusade,@tendertroubador is this a subtweet of the dm group,948018042184671232,tendertroubador,Uhh I'm seeing a lot of horny on this beautiful new monday,948016038536507392
128,devinmontrel,@_MorgW don’t subtweet me it’s 2018,948017288212631552,_MorgW,Ppl not loyal anymore its kinda sad,948017112190251008
129,dixieordie,@SilvestriSalena LMAO heck of a subtweet to the boy,948017024046858240,SilvestriSalena,I physically can't stop watching Say Yes to The Dress. The wedding fever is high these days.,947983654420209666
130,Laura_Grace_98,@lili_is_awesome You don’t have to subtweet me anymore 😂,948015696486780929,lili_is_awesome,Only bitter and jealous people will think it’s disrespectful,948015455121395712
131,QueenHaybo,@see_bolte u can't subtweet yourself like this,948015056914079744,see_bolte,"vegans: *want you to shut up about their diet*

also vegans: *won’t shut up about their diet*",948013767299817479
132,emilynkane,@Zachary_Isom *narcissistically hopes this is a subtweet at me*,948014443111251968,Zachary_Isom,Instagram really is the soothing tool that brings people’s lives from far away (and from more beautiful/serene places) right to your couch.,948010414247436288
133,thefakedana,@StoryTom way to subtweet your wife,948013113550372864,StoryTom,"an app where, when people start talking about the British monarchy, I can summon someone who can stand in for me while I do anything else",947977624915079169
134,walterrgouveia,@_kirstenortiz It’s 2018. We don’t subtweet anymore,948011426433572864,_kirstenortiz,YOURE SO CUTE BUT SO RETARDED,948010357179551744
135,WoooooTheReds,@bitterRedsfan Allaire can see your tweets again. So no need to subtweet him like this.,948007483724967936,bitterRedsfan,This game is better than sex!,948007130581340160
136,wteffs,@BananenBarry ich fick diesen subtweet,948005498841915398,BananenBarry,Die wirklich schwulen sind die die nie schwule tweets machen,947998596858896385
137,INukeYou,@rrquinta Is this a subtweet to me,948002548182585344,rrquinta,God some gamers are snobbish assholes,948002320217985024
138,_danielledgaf,@ArthurTbfh did u just subtweet me,947993708892434432,ArthurTbfh,ppl who laugh so hard at their own jokes that they cant even finish the joke because theyre laughing so hard r my favorite kind of people,932247719086837761
139,SleepyEyesGFX,@OddWheatFarmer is this a subtweet?,947991259670605826,OddWheatFarmer,Cant think of a main or a tag help,947991154104168448
140,PatrickDearden,@lolipsycho Nice subtweet me!😳😱👍,947988322433060864,lolipsycho,Please stop I only love Patrick.,947984484061851648
141,Eulonaut,@storschi subtweet,947988143206223872,storschi,verewig dich mal lieber in meinem herzen,947988095663734784
142,moonlighttwords,@MoeAdamsTV I wonder who you subtweet about...,947987006625378305,MoeAdamsTV,"Sweetheart, you can’t expect a man to treat you like a princess when you’re treating him half-assed.",947978127694880768
143,ahlexaa,@dravidr Why you starting the year with a subtweet 😂 let people liveeee,947982547916591104,dravidr,All this guy does is pose with bottles and post pics 😂 lmao,947962432944857088
144,PS_shift1,@Pazx13 subtweet them but in a nice subtweet,947982440403841025,Pazx13,ok google what's the appropriate etiquette when someone cool follows you back on twitter,947980953523142656
